Title,Authors,Published Date,Description,Page Count,Categories,Category
The Prophet,Kahlil Gibran,2021-08-01,"Lebanese-American author Kahlil Gibran's The Prophet is one of the world's best-selling books of poetry. In twenty-six poetic essays, Gibran writes from the perspective of fictional prophet Almustafa, who has recently returned to his place of birth, Orphalese. The poems detail Almustafa's philosophies on important subjects such as crime and punishment, death, and marriage, as well as everyday subjects such as clothing and eating and drinking. Other poetic essays in The Prophet include ""Joy and Sorrow,"" ""Freedom,"" and ""Good and Evil."" This unabridged edition was first published in 1923.",96.0,Poetry,Poetry
Rosmersholm,Henrik Ibsen,2024-04-22,"""Rosmersholm"" by Henrik Ibsen is a compelling drama that delves into the complexities of morality, politics, and personal liberation. Set in a rural Norwegian estate, the play follows the protagonist, John Rosmer, a former clergyman, and his relationship with Rebecca West, a spirited and enigmatic woman with progressive ideals. As Rosmer grapples with his own convictions and the legacy of his family, he finds himself drawn into a web of intrigue and betrayal that threatens to shatter the illusions of his sheltered existence. Through its exploration of guilt, redemption, and the clash between tradition and modernity, ""Rosmersholm"" offers a thought-provoking examination of the human condition and the quest for personal autonomy. Ibsen's penetrating insight and psychological depth make ""Rosmersholm"" a timeless masterpiece that continues to resonate with audiences today.",96.0,Poetry,Poetry
Evgeniy Onegin,Alexander Pushkin,2015-08-16,"Roman v stihah «Evgenij Onegin» stal central'nym sobytiem v literaturnoj zhizni pushkinskoj pory. I s teh por shedevr A.S. Pushkina ne utratil svoej populjarnosti, po-prezhnemu ljubim i pochitaem millionami chitatelej.Pojema prekrasno illjustrirovana!",242.0,,Poetry
The Metamorphoses Of Ovid,Ovid,2017-01-18,"Through National Book Award-winning translator Allen Mandelbaum's poetic artistry, this gloriously entertaining achievement of literature — classical myths filtered through the worldly and far from reverent sensibility of the Roman poet Ovid — is revealed anew.Savage and sophisticated, mischievious and majestic, witty and wicked, The Metamorphoses weaves together every major mythological story to display a dazzling array of miraculous changes, from the time chaos is transformed into order at the moment of creation, to the time when the soul of Julius Caeser is turned into a star and set in the heavens. In its earthiness, its psychological acuity, this classic work continues to speak over the centuries to our time. ""Reading Mandelbaum's extraordinary translation, one imagines Ovid in his darkest moods with the heart of Baudelaire...Brilliant.""—Booklist",573.0,Literary Criticism,Poetry
Faust,Johann Wolfgang von Goethe,1974,"Goethe fue un poeta, novelista, dramaturgo y cientifico aleman que ayudo a fundar el romanticismo, movimiento al que influencio profundamente. En palabras de George Eliot fue el mas grande hombre de letras aleman... y el ultimo verdadero hombre universal que camino sobre la tierra. Su obra, que abarca generos como la novela, la poesia lirica, el drama e incluso controvertidos tratados cientificos, dejo una profunda huella en importantes escritores, compositores, pensadores y artistas posteriores, siendo incalculable en la filosofia alemana posterior y constante fuente de inspiracion para todo tipo de obras.""",188.0,Drama,Poetry
Mirabai,,2004-11-01,"Mirabai is a literary and spiritual figure of legendary proportions. Born a princess in the region of Rajasthan in 1498, Mira (as she is more commonly known) eschewed the marriage her royal family had arranged for her, celebrating instead her right to independence and intense devotion to Krishna in both her life and poetry. In this collection, Robert Bly and Jane Hirshfield, two of America's best poets, have created lively English versions of Mirabai's poems, using fresh images and energetic rhythms to make them accessible to modern readers.",102.0,Poetry,Poetry
Jerusalem,William Blake,1991,"Jerusalem: the emanation of the giant Albion, v.1. Songs of innocence and of experience, v.2. The Continental prophecies; America: a prophecy; Europe: a prophecy; The song of Los, v.4. Milton a poem and the final illuminated works: The ghost of Abel; On Homer's poetry [and] on Virgil Laocoon, v.5. The Urizen books; The first book of Urizen; The book of Ahania; The book of Los, v.6.",326.0,Literary Criticism,Poetry
The Love of Centuries,The Supreme Master Ching Hai,2011-01-01,"Poetry is an artistic, stylistic expression and reflection of the spirit. Wu Tzu’s poems transcend the preconceived thinking of worldly people, just like a pure lotus amidst the dusty world, a radiant lighthouse in the stormy sea, and a rainbow across a dark cloudy sky. The style of Wu Tzu’s poetry is sometimes soft and gentle as a slow flowing stream, or sometimes vibrant and forceful as a thousand horses racing. Her verses are imbued with graceful and otherworldly qualities. When expressed in the Poet’s simple, conversational words, these verses often belie their profound meanings and pure lyrical beauty. With a refreshing choice of words and harmonious rhythms in Her poems, the Poet has created a beautiful, ethereal world, as well as a poetic style that is at once romantic and splendid. Above all, these poems seem to have been created with total spontaneity, and yet their effect is total enchantment.",194.0,Literary Criticism,Poetry
"The Kalevala, the Epic Poem of Finland",Anonymous,2018-02-22,"This work has been selected by scholars as being culturally important, and is part of the knowledge base of civilization as we know it. This work was reproduced from the original artifact, and remains as true to the original work as possible. Therefore, you will see the original copyright references, library stamps (as most of these works have been housed in our most important libraries around the world), and other notations in the work. This work is in the public domain in the United States of America, and possibly other nations. Within the United States, you may freely copy and distribute this work, as no entity (individual or corporate) has a copyright on the body of the work. As a reproduction of a historical artifact, this work may contain missing or blurred pages, poor pictures, errant marks, etc. Scholars believe, and we concur, that this work is important enough to be preserved, reproduced, and made generally available to the public. We appreciate your support of the preservation process, and thank you for being an important part of keeping this knowledge alive and relevant.",460.0,History,Poetry
Concerning the Angels,Rafael Alberti,1995,"First published in Spain in the summer of 1929, Concerning the Angels (Sobre los angeles) is the great Spanish poet Rafael Alberti's masterpiece, on a par with T.S. Eliot's The Waste Land, Pablo Neruda's Residencia en la tierra, and Federico Garcia Lorca's Poeta en Nueva York. It marks a major departure from the light-hearted tone of the poet's earlier verse, which was notably influence by Andalusian folksong. This bilingual text is at once intensely imaginative and intimately realistic, a lyrical illumination of the poet's ""dark night of the soul."" Rafael Alberti, born in 1902, is the last surviving member of the so-called Generation of 1927 that included such notable Spanish poets Federico Garcia Lorca, Vincente Alexandre, Pedro Salinas, Jorge Guillen, and Luis Cernuda. Christopher Sawyer-Laucanno lives in Massachusetts and teaches in the program in Writing and Humanistic Studies at MIT.",172.0,Poetry,Poetry
New Poems,Rainer Maria Rilke,2001-12-10,"Rilke's first great work ... [Snow's translation] is clear, accurate, and fluent. --Stephen Mitchell.",351.0,Poetry,Poetry
The Canterbury Tales,Geoffrey Chaucer,1982-02-01,"Lively, absorbing, often outrageously funny, Chaucer’s The Canterbury Tales is a work of genius, an undisputed classic that has held a special appeal for each generation of readers. The Tales gathers twenty-nine of literature’s most enduring (and endearing) characters in a vivid group portrait that captures the full spectrum of medieval society, from the exalted Knight to the humble Plowman. This new edition includes a comprehensive introduction that summarizes some of the most important historical events and movements that defined the world of Chaucer and his pilgrims; two additional tales (Reeve’s and Shipman’s); introductions for each tale designed to prepare the reader for a better understanding and enjoyment of the tale; newly written and conveniently placed explanatory notes; and a new, more easily understood system for learning to pronounce Chaucerian Middle English.",0.0,Poetry,Poetry
Friends Learn Ballet,Janeen Brian,1985,"Ellie practices ballet steps with her friend Natalie and both dream of becoming ballet dancers. Includes a vocabulary list, discussion questions, and a note for grownups.",36.0,Juvenile Nonfiction,Juvenile Fiction
Henry's Leg,Ann Pilling,1986-10,No description available,158.0,Children of divorced parents,Juvenile Fiction
Behind the Gates,Eva Gray,2011,"In a Chicago troubled by the war against the Alliance, Louisa and her best friend, Maddie, disguised as her twin sister, are sent to the exclusive Country Manor School, where they are cut off from the outside world and learn survival skills.",0.0,Boarding schools,Juvenile Fiction
The Grizzly,"Annabel Johnson, Edgar Johnson",1964,"When Mark, the father David scarcely knows, arrives to take him on a weekend fishing trip, David is tense and nervous. His parents have been separated for years, and David is nervous around his father. When a giant grizzly bear attacks their camp, injures Mark, and eats their provisions, David must take charge. But can he get himself and his injured father out of the forest in time?",184.0,Juvenile Fiction,Juvenile Fiction
Spring Is Here,Houghton Mifflin Company,2000-02-07,"Follows the four seasons around the year, from snow melting into spring, through the quiet harvest and the fall of snow, and then to spring again.",48.0,Juvenile Nonfiction,Juvenile Fiction
Stalky & Co,Rudyard Kipling,1938,No description available,272.0,Juvenile,Juvenile Fiction
Cleopatra VII,Kristiana Gregory,1999,"While her father is in hiding after attempts on his life, twelve-year-old Cleopatra records in her diary how she fears for her own safety and hopes to survive to become Queen of Egypt some day.",221.0,Cleopatra,Juvenile Fiction
The Three Robbers,Tomi Ungerer,1962,A story of three robbers who spent their loot on a castle for sad or abandoned children.,48.0,Attitude change,Juvenile Fiction
Camp Big Paw,Doug Cushman,1990,Cyril and his cabin mates Ben and Obie run into trouble with the camp bully during Field Day contests at Camp Big Paw.,64.0,Bullies,Juvenile Fiction
Otto and the Secret Light of Christmas,Nora Surojegin,2016-09-15,"Otto, an elfin adventurer, finds a postcard on the seashore showing pictures of beautiful sparkling lights in the night sky with the words, ""The light of Christmas!"" Otto decides he must find this brightness. So he heads north, trudging through the dark forests and skiing towards the fells of Lapland, in search of the secret light of Christmas.",108.0,Christmas stories,Juvenile Fiction
While the Clock Ticked,Franklin W. Dixon,1975-04-01,A clock in a vacant house provides a clue to the whereabouts of a gang of harbor thieves,174.0,Juvenile Fiction,Juvenile Fiction
Budding Ballerina,Jane O'Connor,2013-10-08,"For use in schools and libraries only. When Fancy Nancy learns that her father and the rest of her family have a lot to learn about ballet, she decides to open up her own ballet school.",0.0,Ballet,Juvenile Fiction
Caring Animals,Rosanna Hansen,2003,"Ideal for today's young investigative reader, each A True Book includes lively sidebars, a glossary and index, plus a comprehensive ""To Find Out More"" section listing books, organizations, and Internet sites. A staple of library collections since the 1950s, the new A True Book series is the definitive nonfiction series for elementary school readers.",56.0,Juvenile Nonfiction,Juvenile Fiction
Waterless Mountain,Laura Adams Armer,1977,No description available,212.0,Navajo Indians,Juvenile Fiction
You Wouldn't Want to Live Without Soap!,Alex Woolf,2015-09,"For use in schools and libraries only. Would you rather put your grubby clothes in the washing machine, or take them down to the river and beat the dirt out of them? You re lucky to have the choice! Soaps and detergents are among the great benefits of modern life. They help to keep us comfort",0.0,JUVENILE NONFICTION,Juvenile Fiction
Academic Language in Diverse Classrooms: Definitions and Contexts,"Margo Gottlieb, Gisela Ernst-Slavit",2014-04-22,"With the rigorous content of College and Career Readiness standards, academic language use has moved to the forefront of educational priorities. School leaders and teachers must ensure that academic language becomes the focus of new curricula, instruction, and assessment, with special attention to linguistically and culturally diverse students. Margo Gottlieb and Gisela Ernst-Slavit's six-book series on academic language is already the definitive resource on the topic. This companion volume provides a concise, thorough overview of the key research concepts and effective practices that underlie the series. It includes, Definitions and examples of the dimensions of academic language, A step-by-step template to incorporate academic language use into plans for student learning, Graphic models that illustrate the construct of academic language and its classroom application, Language is the most fundamental building block of education. Be sure your school is as strong as it can be with this indispensable book.",257.0,Education,Language Arts & Disciplines
Identity Meets Nationality,"Helen Lauer, Nana Aba Appiah Amfo, Jemima Asabea Anderson",2011,"Questions about how social conditioning and historical circumstances influence assumptions about who we are and how others perceive who we are have attracted wide ranging discussion across the disciplines in the arts, humanities and allied sciences. Simultaneously, since the Independence period, scholars have deliberated over the varied implications of new states emerging throughout Africa. The peer-reviewed selected papers for this anthology represent a cross section of the diverse perspectives reflecting research and cross-disciplinary collaborations undertaken by members of the University of Ghana faculty and graduate students working in archaeology, literary criticism of African as well as English and Russian literatures, economics, history, cognitive psychology, linguistics, dance, music, philosophy, sociology, and the study of religions.",314.0,Education,Language Arts & Disciplines
Language and Thinking in School,Kenneth S. Goodman,1987,No description available,440.0,Education,Language Arts & Disciplines
Musico-poetics in Perspective,"Ulrich Weisstein, Jean-Louis Cupers",2000,"The volume is dedicated to the memory of the late Calvin S. Brown of the University of Georgia, author of the first systematically conceived survey - Music and Literature: A Comparison of the Arts (1948) - of the branch of interart studies now generally known as Melopoetics. Part One consists of six original contributions by experts from Austria, Belgium, France, and the United States. Authored by a novelist and a composer/scholar, respectively, the first two essays - Jean Libis's ""Inspiration musicale et composition littéraire: Réflexions sur un roman schubertien"" and David M. Hertz's ""The Composer's Musico-Literary Experience: Reflections on Song Writing"" - focus, not surprisingly, on the creative process. The third piece - Francis' Claudon's review of the pertinent research done between 1970 and 1990 - complements the honoree's analogous report on the preceding decades, reprinted in the present volume, whereas the fourth - Jean-Louis Cupers' ""Métaphores de l'écho et de l'ombre: Regards sur l'évolution des études musico-littéraires"" - surveys the plethora of metaphorical applications, in music and literature, of two significant natural phenomena, the one acoustic and the other optical. Linked to each other, the two remaining papers - Ulrich Weisstein's ""The Miracle of Interconnectedness: Calvin S. Brown, a Critical Biography"" and Walter Bernhart's ""A Profile in Retrospect: Calvin S. Brown as a Musico-Literary Scholar"" - offer critical accounts of the honoree's theoretical and methodological stance as viewed, in the first case, from a biographical angle and, in the second, in the light of subsequent scholarly practice. Part Two bundles eleven of Professor Brown's previously uncollected articles, covering a period of nearly half a century of significant scholarly activity in the field. The selection demonstrates Brown's poignant interest in transpositions d'art exemplifying the ""musicalization"" of literature in the formal and structural, rather than thematic, domain as culminating in his trenchant critique of ""music in poetry"" as understood, somewhat naïvely, by Mallarmé and his critics, and, to a slightly lesser extent, by his translation of Josef Weinhebers' variations on Friedrich Hölderlin's ode ""An die Parzen"". Just as Professor Brown's successive anatomies of melopoetic theory and practice illustrate his steadily growing sophistication and the maturing of his mind, so his Bloomington lecture ""The Writing and Reading of Language and Music: Thoughts on Some Parallels Between two Artistic Media"" reflects his unique ability to assemble, and organize, vast materials and comprehensive data in such a way as to reveal the underlying pattern.",344.0,Art,Language Arts & Disciplines
Novissima linguarum methodus,"Johann Amos Comenius, Honoré Jean, Gilles Bibeau, Jean Caravolas, Claire Le Brun-Gouanvic",2005,No description available,1014.0,Education,Language Arts & Disciplines
The Cambridge Companion to Adam Smith,Knud Haakonssen,2006-03-06,"Adam Smith is best known as the founder of scientific economics and as an early proponent of the modern market economy. Political economy, however, was only one part of Smith's comprehensive intellectual system. Consisting of a theory of mind and its functions in language, arts, science, and social intercourse, Smith's system was a towering contribution to the Scottish Enlightenment. His ideas on social intercourse also served as the basis for a moral theory that provided both historical and theoretical accounts of law, politics, and economics. This Companion volume provides an examination of all aspects of Smith's thought. Collectively, the essays take into account Smith's multiple contexts - Scottish, British, European, Atlantic; biographical, institutional, political, philosophical - and they draw on all of his works, including student notes from his lectures. Pluralistic in approach, the volume provides a contextualist history of Smith, as well as direct philosophical engagement with his ideas.",442.0,Business & Economics,Language Arts & Disciplines
Suggestopedia and Language Acquisition,W. Jane Bancroft,1999,"First Published in 1999. Routledge is an imprint of Taylor & Francis, an informa company.",324.0,Foreign Language Study,Language Arts & Disciplines
Semiotics Unbounded,"Susan Petrilli, Augusto Ponzio",2005-01-01,"The more human knowledge increases, the more signs grow and, with this expansion, the more the boundaries of the science that studies signs also grows. In Semiotics Unbounded, Susan Petrilli and Augusto Ponzio explain the explosion of the sign network in the era of global communication and discuss the important theoretical responses offered by semiotics. Providing a much-needed introductory guide to the subject, Petrilli and Ponzio explore the ever-growing frontiers of semiotics through the thought of prominent sign scholars such as Charles Peirce, Victoria Welby, Mikhail Bakhtin, Charles Morris, and Thomas Sebeok. In an era of global communication, a global approach is necessary, and what may seem to be the whole, is only a part - a view being at once globalizing and open. Each and every sign is never self-sufficient and closed but exists always in a relation of otherness. This is true of the signs forming animals and human beings, individuals and communities, and involves the implication of all living beings in the life of all others. Semiotics Unbounded offers a new and original survey of the science of signs, evaluating it in relation to the problems of our time, not only of a scientific order, but also the problems concerning everyday social life.",657.0,Literary Criticism,Language Arts & Disciplines
Teaching English,Susan Brindley,1994,"The place of English in the secondary curriculum has been the subject of intense debate in the general media as well as in education circles. This reader addresses the key issues of that debate in a way that is both accessible and lively. Separate sections cover the historical background to the debate, including the major teaching areas of speaking, listening, reading and writing, assessment and the professional development of teachers within the subject. Specially commissioned articles look at some of the most controversial issues in the subject--for instance the place of grammar and the centrality of literature in the curriculum. Novice English teachers will find this book an invaluable introduction to the complexities of their subject. For their more experienced colleagues, this text will be an invaluable way to keep up to date with current thinking.",292.0,Art,Language Arts & Disciplines
Language Change,Goparaju Sambasiva Rao,1994,No description available,188.0,India,Language Arts & Disciplines
The Soul in the Brain,Michael R. Trimble,2007-04-17,"By examining the breakdown of language in several neuropsychiatric disorders, neuroscientists have identified brain circuits that are involved with metaphor, poetry, music, and religious experiences.",305.0,Art,Language Arts & Disciplines
Danish dictionary,"Anna Garde, W. Glyn Jones",1995,"Ideal for the serious learner and user of Danish, this two-way dictionary includes accurate translations supported by pertinent examples. Entries are supplemented by a section covering Danish pronunciation and grammar.",978.0,Foreign Language Study,Language Arts & Disciplines
"Bhartr̥hari, Philosopher and Grammarian","Saroja Bhate, Johannes Bronkhorst",1994,"Bhartrhari lived in the tenth century c.e. Being both a grammarian and philosopher, his influence on subsequent grammatical and philosophical thought in India has been enormous in spite of this modern scholarship has not yet given him the attention he deserves no doubt because his extent writings are difficult and were not until recently, available in satisfactory editions. Interest among scholars for Bhartrhari is now, however, growing. This is the reason why an international conference on Bhartrhari was organized in January 1992 in Pune, under the joint auspices of the University of Poons and the University of Lausanne (Switzerland). The present volume contains some of the papers read at this conference as well as an up-to-date bibliography on Bhartrhari.",292.0,Biography & Autobiography,Language Arts & Disciplines
Scripting Addiction,E. Summerson Carr,2010-11-03,"Scripting Addiction takes readers into the highly ritualized world of mainstream American addiction treatment. It is a world where clinical practitioners evaluate how drug users speak about themselves and their problems, and where the ideal of ""healthy"" talk is explicitly promoted, carefully monitored, and identified as the primary sign of therapeutic progress. The book explores the puzzling question: why do addiction counselors dedicate themselves to reconciling drug users' relationship to language in order to reconfigure their relationship to drugs? To answer this question, anthropologist Summerson Carr traces the charged interactions between counselors, clients, and case managers at ""Fresh Beginnings,"" an addiction treatment program for homeless women in the midwestern United States. She shows that shelter, food, and even the custody of children hang in the balance of everyday therapeutic exchanges, such as clinical assessments, individual therapy sessions, and self-help meetings. Acutely aware of the high stakes of self-representation, experienced clients analyze and learn to effectively perform prescribed ways of speaking, a mimetic practice they call ""flipping the script."" As a clinical ethnography, Scripting Addiction examines how decades of clinical theorizing about addiction, language, self-knowledge, and sobriety is manifested in interactions between counselors and clients. As an ethnography of the contemporary United States, the book demonstrates the complex cultural roots of the powerful clinical ideas that shape therapeutic transactions--and by extension administrative routines and institutional dynamics--at sites such as ""Fresh Beginnings.""",336.0,Language Arts & Disciplines,Language Arts & Disciplines
Language in Learning and Teaching (LILT),"Margaret Inglis, Carol Thomson, Carol A. Macdonald",2000,No description available,232.0,Children,Language Arts & Disciplines
