Title,Authors,Published Date,Description,Page Count,Categories,Category
From the Indian Ocean to the Mediterranean,Sebouh Aslanian,2011-05-04,"Drawing on a rich trove of documents, including correspondence not seen for 300 years, this study explores the emergence and growth of a remarkable global trade network operated by Armenian silk merchants from a small outpost in the Persian Empire. Based in New Julfa, Isfahan, in what is now Iran, these merchants operated a network of commercial settlements that stretched from London and Amsterdam to Manila and Acapulco. The New Julfan Armenians were the only Eurasian community that was able to operate simultaneously and successfully in all the major empires of the early modern world—both land-based Asian empires and the emerging sea-borne empires—astonishingly without the benefits of an imperial network and state that accompanied and facilitated European mercantile expansion during the same period. This book brings to light for the first time the trans-imperial cosmopolitan world of the New Julfans. Among other topics, it explores the effects of long distance trade on the organization of community life, the ethos of trust and cooperation that existed among merchants, and the importance of information networks and communication in the operation of early modern mercantile communities.",389.0,History,History
War Beneath the Sea,Peter Padfield,1995,"""Peter Padfield is the best British naval historian of his generation now working. [This] book . . . will now become the standard work on the subject.""––John Keegan ""A fascinating and great contribution to the entire lore of submarines.""––Capt. Edward L. Beach, USN (ret.), author of Run Silent, Run Deep War Beneath the Sea is the definitive account of one of the most turbulent—and crucial—chapters of World War II. This is the first book to cover all the major submarine campaigns of the war: British, American, German, Japanes, and Italian. Padfield′s suspense–filled battle accounts vividly capture the tension and challenge of war beneath the sea. PETER PADFIELD (England) is a leading naval and military historian. He is the author of Guns at Sea, Armada, Tides of Empire , and Donitz: The Last Furher .",600.0,History,History
Images of Nebuchadnezzar,Ronald Herbert Sack,2004,"Images of Nebuchadnezzar attempts to probe the diversity of cultural attitudes reflected in the characterizations of this famous king through an examination of both the original cuneiform sources as well as the accounts of chronographers written in Greek, Roman, and medieval times. Included in this revised and expanded second edition are two new chapters that examine both Nebuchadnezzar's administrative policies and the impact that his death had on both contemporary and later cultures. Both the positive and negative images of the king are explored, with conclusions being developed as to what the authors of the various surviving accounts actually thought the king really was. In the process, the whole nature of historiography in the ancient world is analyzed, and a number of broad conclusions are developed. Anyone who has ever read Second Kings or the books of Daniel and Jeremiah of the Old Testament is familiar with the name of Nebuchadnezzar, the king of Babylon who conquered the kingdom of Judah and destroyed Solomon's temple. As the second member of the Chaldean dynasty of Mesopotamia (626-539 B.C.), he ruled for forty-three years (605-562 B.C.), during which time he also led military campaigns into Syria and Lebanon. He also organized a number of building projects that were to transform Babylon into one of the seven wonders of the ancient world. Among his noteworthy achievements were the construction of massive fortification walls around Babylon, the refurbishing of Marduk's temple in the city, and the building of huge palaces that served as the king's residences. Tales of these legendary achievements, as well as those of his father, Nabopolassar (626-605 B.C.), also found their way into the narratives of a number of Greek, Roman, and medieval historians and chronographers many centuries later. Unfortunately, much of the record of Nebuchadnezzar's achievements that was written in his own time has not survived. Instead, only secondary accounts of his military campaigns or his construction projects in Babylon written in Greek, Latin, Hebrew, or Arabic are available for analysis. These stories vary greatly in content and emphasis and, in many cases, distort much of what we know from Nebuchadnezzar's own sources. The Hebrews, for example, described Nebuchadnezzar's siege of Jerusalem in such a way as to consider it something that should never again be repeated. The Greeks, on the other hand, saw the building projects in Babylon as evidence of almost superhuman achievements, as monuments that were the result of efforts by a king who was almost godlike. Why, then, is there such diversity in the characterizations of Nebuchadnezzar? This book proposes answers to these questions.",202.0,Biography & Autobiography,History
Ecology of Java & Bali,"Tony Whitten, Roehayat Emon Soeriaatmadja, Suraya A. Afiff",1996,"Series blurb: The Ecology of Indonesia series explores one of the most biologically diverse areas of the world, incorporating current research from Western and Indonesian specialists. Each book describes in detail, Indonesia's fragile ecosystems, its unparalled biodiversity, its peoples andtheir use of natural resources, and the ecological problems which have resulted from rapid economic development.",1040.0,Nature,History
Sunset Park,Paul Auster,2010-11-04,"Paul Auster's Sunset Park is set in the sprawling flatlands of Florida, where twenty-eight-year-old Miles is photographing the last lingering traces of families who have abandoned their houses due to debt or foreclosure. Miles is haunted by guilt for having inadvertently caused the death of his step-brother, a situation that caused him to flee his father and step-mother in New York seven years ago. What keeps him in Florida is his relationship with a teenage high-school girl, Pilar, but when her family threatens to expose their relationship, Miles decides to protect Pilar by going back to Brooklyn, where he settles in a squat to prepare himself to face the inevitable confrontation with his father - a confrontation he has been avoiding for years. Set against the backdrop of the devastating global recession, and pulsing with the energy of Auster's previous novel Invisible, Sunset Park is as mythic as it is contemporary, as in love with baseball as it is with literature. It is above all, a story about love and forgiveness - not only among men and women, but also between fathers and sons.",318.0,Fiction,History
The Last Empire,Serhii Plokhy,2015-09-08,"On Christmas Day, 1991, President George H. W. Bush addressed the nation to declare an American victory in the Cold War: earlier that day Mikhail Gorbachev had resigned as the first and last Soviet president. The enshrining of that narrative, one in which the end of the Cold War was linked to the disintegration of the Soviet Union and the triumph of democratic values over communism, took center stage in American public discourse immediately after Bush's speech and has persisted for decades -- with disastrous consequences for American standing in the world. As prize-winning historian Serhii Plokhy reveals in The Last Empire, the collapse of the Soviet Union was anything but the handiwork of the United States. On the contrary, American leaders dreaded the possibility that the Soviet Union -- weakened by infighting and economic turmoil -- might suddenly crumble, throwing all of Eurasia into chaos. Bush was firmly committed to supporting his ally and personal friend Gorbachev, and remained wary of nationalist or radical leaders such as recently elected Russian President Boris Yeltsin. Fearing what might happen to the large Soviet nuclear arsenal in the event of the union's collapse, Bush stood by Gorbachev as he resisted the growing independence movements in Ukraine, Moldova, and the Caucasus. Plokhy's detailed, authoritative account shows that it was only after the movement for independence of the republics had gained undeniable momentum on the eve of the Ukrainian vote for independence that fall that Bush finally abandoned Gorbachev to his fate. Drawing on recently declassified documents and original interviews with key participants, Plokhy presents a bold new interpretation of the Soviet Union's final months and argues that the key to the Soviet collapse was the inability of the two largest Soviet republics, Russia and Ukraine, to agree on the continuing existence of a unified state. By attributing the Soviet collapse to the impact of American actions, US policy makers overrated their own capacities in toppling and rebuilding foreign regimes. Not only was the key American role in the demise of the Soviet Union a myth, but this misplaced belief has guided -- and haunted -- American foreign policy ever since.",544.0,History,History
Undoing Gender,Judith Butler,2004,"First Published in 2004. Routledge is an imprint of Taylor & Francis, an informa company.",292.0,Literary Criticism,History
Great Catastrophe,Thomas De Waal,2015,"Drawing on archival sources, reportage and moving personal stories, de Waal tells the full story of Armenian-Turkish relations since the Genocide in all its extraordinary twists and turns. He looks behind the propaganda to examine the realities of a terrible historical crime and the divisive ""politics of genocide"" it produced.",321.0,History,History
Proclaiming the Truman Doctrine,Denise M. Bostdorff,2008,"In this work, Denise M. Bostdorff considers President Truman’s address to a joint session of Congress on March 12, 1947. She focuses on the public and private language that influenced administration perceptions about the precipitating events in Greece and Turkey and explores the news management campaign that set the stage for Truman’s speech. Bostdorff even examines how the president’s health may have influenced his policy decision and how it affected his delivery of the address and campaign for congressional approval. After a rhetorical analysis of the Truman Doctrine speech, the book ends with Bostdorff’s conclusions on its short- and long-term impact. She identifies themes announced by Truman that resound in U.S. foreign policy down to the present day, when George W. Bush has compared his policies in the war on terror to those of Truman and members of his administration have compared Bush to Truman. This important work is a major contribution to scholarship on the presidency, political science, and public rhetoric.",216.0,Biography & Autobiography,History
The Making of the Roman Army,L. J. F. Keppie,1984,No description available,298.0,History,History
The Twelve Caesars,Suetonius,2018-04-18,"One of antiquity's great historical resources, this chronicle portrays the lives and reigns of Julius Caesar and his 11 immediate successors.",659.0,History,History
The Gates of Europe,Serhii Plokhy,2015-12-01,"Ukraine is currently embroiled in a tense battle with Russia to preserve its economic and political independence. But today's conflict is only the latest in a long history of battles over Ukraine's existence as a sovereign nation. As award-winning historian Serhii Plokhy argues in The Gates of Europe, we must examine Ukraine's past in order to understand its fraught present and likely future. Situated between Europe, Russia, and the Asian East, Ukraine was shaped by the empires that have used it as a strategic gateway between East and West—from the Romans and Ottomans to the Third Reich and the Soviet Union, all have engaged in global fights for supremacy on Ukrainian soil. Each invading army left a lasting mark on the landscape and on the population, making modern Ukraine an amalgam of competing cultures. Authoritative and vividly written, The Gates of Europe will be the definitive history of Ukraine for years to come.",433.0,History,History
Late Enlightenment,"Balázs Trencsényi, Michal Kopeček",2006-06-15,"Presents an interpretative synthesis that challenges the self-centered and ""isolationist"" historical narratives and educational canons prevalent in the many countries of Central and Southeast Europe. This title aims to confront 'mainstream' and seemingly successful national discourses with each other.",376.0,History,History
The Prince,Niccolo Machiavelli,2017-03,"The Prince is Niccolo Machiavelli's astute observations on how to read people and situations to acquire power, and is a classic primer for politicians and business leaders alike. Written during the Italian Renaissance, Niccolo Machiavelli's astute observations on how to read people and situations, especially for acquiring and maintaining political power, is a classic primer for politicians and business leaders alike. Whether you approach this reading for its historical significance or choose to apply this knowledge toward achieving success in your own life, you will be enriched. This elegantly designed clothbound edition features an elastic closure and a new introduction.",258.0,History,History
After the Collapse,Dimitri K. Simes,1999,"With an insider's view, an expert on Russia and former foreign policy advisor to President Nixon argues that Russia is returning to the world stage as a great power and intends to resume a major role in international affairs.",280.0,Russia (Federation),History
Sleeping with the Devil,Robert Baer,2003,"“Saudi Arabia is more and more an irrational state—a place that spawns global terrorism even as it succumbs to an ancient and deeply seated isolationism, a kingdom led by a royal family that can’t get out of the way of its own greed. Is this the fulcrum we want the global economy to balance on?” In his explosive New York Times bestseller,See No Evil, former CIA operative Robert Baer exposed how Washington politics drastically compromised the CIA’s efforts to fight global terrorism. Now in his powerful new book, Sleeping with the Devil, Baer turns his attention to Saudi Arabia, revealing how our government’s cynical relationship with our Middle Eastern ally and America’s dependence on Saudi oil make us increasingly vulnerable to economic disaster and put us at risk for further acts of terrorism. For decades, the United States and Saudi Arabia have been locked in a “harmony of interests.” America counted on the Saudis for cheap oil, political stability in the Middle East, and lucrative business relationships for the United States, while providing a voracious market for the kingdom’s vast oil reserves. With money and oil flowing freely between Washington and Riyadh, the United States has felt secure in its relationship with the Saudis and the ruling Al Sa’ud family. But the rot at the core of our “friendship” with the Saudis was dramatically revealed when it became apparent that fifteen of the nineteen September 11 hijackers proved to be Saudi citizens. InSleeping with the Devil, Baer documents with chilling clarity how our addiction to cheap oil and Saudi petrodollars caused us to turn a blind eye to the Al Sa’",266.0,Current Events,History
Peace Process,William B. Quandt,2005,"Updated through the first term of President George W. Bush, this edition analyses how each US president since Lyndon Johnson has dealt with the complex challenge of Arab-Israeli peacemaking.",558.0,History,History
"The History of Adult Education in which is Comprised a Full and Complete History of the Mechanics' and Literary Institutions, Athenaeums, ...",James William Hudson,1851,No description available,294.0,Adult education,Literary Collections
The Bedford Glossary of Critical and Literary Terms,"Ross C. Murfin, Supryia M. Ray",2009,"This is the third edition of an essential glossary for students, now thoroughly updated and expanded with more than 50 new literary and critical terms. This title offers a comprehensive reference that clearly and accessibly defines over 850 important literary and critical terms from classical times to the present. It is thoroughly updated and expanded, with more than 50 new terms, including traditional terms, important contemporary terms and introductions to emerging fields of critical study. It features more contemporary examples, including references to movies, TV shows, and bestselling books, and includes new visual examples.",636.0,Literary Collections,Literary Collections
You Made Me Love You,John Edgar Wideman,2021-04-06,Fifty-seven short stories drawn from past collections celebrate the lifelong significance of this major American writer's essential contribution to a form--illuminating the ways that he has made it his own.,496.0,Fiction,Literary Collections
We Are Not Ourselves,Matthew Thomas,2014-08-19,"Destined to be a classic, this ""powerfully moving"" (Chad Harbach, The Art of Fielding), multigenerational debut novel of an Irish-American family is nothing short of a ""masterwork"" (Joshua Ferris, Then We Came to the End). Born in 1941, Eileen Tumulty is raised by her Irish immigrant parents in Woodside, Queens, in an apartment where the mood swings between heartbreak and hilarity, depending on whether guests are over and how much alcohol has been consumed. When Eileen meets Ed Leary, a scientist whose bearing is nothing like those of the men she grew up with, she thinks she's found the perfect partner to deliver her to the cosmopolitan world she longs to inhabit. They marry, and Eileen quickly discovers Ed doesn't aspire to the same, ever bigger, stakes in the American Dream. Eileen encourages her husband to want more: a better job, better friends, a better house, but as years pass it becomes clear that his growing reluctance is part of a deeper psychological shift. An inescapable darkness enters their lives, and Eileen and Ed and their son Connell try desperately to hold together a semblance of the reality they have known, and to preserve, against long odds, an idea they have cherished of the future. Through the Learys, novelist Matthew Thomas charts the story of the American Century, particularly the promise of domestic bliss and economic prosperity that captured hearts and minds after WWII. The result is a riveting and affecting work of art; one that reminds us that life is more than a tally of victories and defeats, that we live to love and be loved, and that we should tell each other so before the moment slips away. Epic in scope, heroic in character, masterful in prose, We Are Not Ourselves heralds the arrival of a major new talent in contemporary fiction.",640.0,Fiction,Literary Collections
Readers' Liberation,Jonathan Rose,2018,"Readers' Liberation addresses question of what we should be reading to obtain information, examining how past readers encountered the same problems that today's readers face, and how they dealt with them.",238.0,Business & Economics,Literary Collections
Wayfaring Stranger,James Lee Burke,2014-07-15,A sprawling thriller drenched with atmosphere and intrigue that takes a young boy from a chance encounter with Bonnie and Clyde to the trenches of World War II and the oil fields along the Texas-Louisiana coast.,448.0,Fiction,Literary Collections
Every Cloak Rolled in Blood,James Lee Burke,2022-05-24,"In his most autobiographical novel to date, James Lee Burke continues the epic Holland family saga with a writer grieving the death of his daughter while battling earthly and supernatural outlaws. Novelist Aaron Holland Broussard is shattered when his daughter Fannie Mae dies suddenly. As he tries to honor her memory by saving two young men from a life of crime amid their opioid-ravaged community, he is drawn into a network of villainy that includes a violent former Klansman, a far-from-holy minister, a biker club posing as evangelicals, and a murderer who has been hiding in plain sight. Aaron’s only ally is state police officer Ruby Spotted Horse, a no-nonsense woman who harbors some powerful secrets in her cellar. Despite the air of mystery surrounding her, Ruby is the only one Aaron can trust. That is, until the ghost of Fannie Mae shows up, guiding her father through a tangled web of the present and past and helping him vanquish his foes from both this world and the next. Drawn from James Lee Burke’s own life experiences, Every Cloak Rolled in Blood is a devastating exploration of the nature of good and evil and a deeply moving story about the power of love and family.",288.0,Fiction,Literary Collections
Theory and Practice of Literacy Work,"Ali Hamadache, Daniel Martin, Canadian Organization for Development through Education",1986,No description available,238.0,Education,Literary Collections
The Western Canon,Harold Bloom,1994,"In his analysis of Freud's interpretations of Shakespeare, Bloomsuggests that the bard so influenced Freud that he worked tirelessly to deny any genius in an ignorant Stratford actor. This chapter focuses on Freud's writings about ""Hamlet"", but significant comments are made on ""King Lear"" and ""Macbeth"".",600.0,Literary Criticism,Literature
ABC of Reading,Ezra Pound,2010,"This important work, first published in 1934, is a concise statement of Pound's aesthetic theory. It is a primer for the reader who wants to maintain an active, critical mind and become increasingly sensitive to the beauty and inspiration of the world's best literature. With characteristic vigor and iconoclasm, Pound illustrates his precepts with exhibits meticulously chosen from the classics, and the concluding ""Treatise on Meter"" provides an illuminating essay for anyone aspiring to read and write poetry. ABC of Reading displays Pound's great ability to open new avenues in literature for our time.",228.0,Education,Literature
What is World Literature?,David Damrosch,2003-03-30,"World literature was long defined in North America as an established canon of European masterpieces, but an emerging global perspective has challenged both this European focus and the very category of ""the masterpiece."" The first book to look broadly at the contemporary scope and purposes of world literature, What Is World Literature? probes the uses and abuses of world literature in a rapidly changing world. In case studies ranging from the Sumerians to the Aztecs and from medieval mysticism to postmodern metafiction, David Damrosch looks at the ways works change as they move from national to global contexts. Presenting world literature not as a canon of texts but as a mode of circulation and of reading, Damrosch argues that world literature is work that gains in translation. When it is effectively presented, a work of world literature moves into an elliptical space created between the source and receiving cultures, shaped by both but circumscribed by neither alone. Established classics and new discoveries alike participate in this mode of circulation, but they can be seriously mishandled in the process. From the rediscovered Epic of Gilgamesh in the nineteenth century to Rigoberta Menchú's writing today, foreign works have often been distorted by the immediate needs of their own editors and translators. Eloquently written, argued largely by example, and replete with insightful close readings, this book is both an essay in definition and a series of cautionary tales.",344.0,Literary Criticism,Literature
"Frankenstein, Or the Modern Prometheus",Mary Wollstonecraft Shelley,1982-03-15,"Mary Shelley's classic on man's blasphemous attempt to create life is accompanied by commentary on the author and the stylistic, thematic, and mythic aspects of the novel.",338.0,Fiction,Literature
On Literature,Umberto Eco,2004,Publisher Description,352.0,Literary Criticism,Literature
The Formation of the Historical World in the Human Sciences,Wilhelm Dilthey,2002,"This volume provides Dilthey's most mature and best formulation of his Critique of Historical Reason. It begins with three ""Studies Toward the Foundation of the Human Sciences,"" in which Dilthey refashions Husserlian concepts to describe the basic structures of consciousness relevant to historical understanding. The volume next presents the major 1910 work The Formation of the Historical World in the Human Sciences. Here Dilthey considers the degree to which carriers of history--individuals, cultures, institutions, and communities--can be articulated as productive systems capable of generating value and meaning and of realizing purposes. Hegel's idea of objective spirit is reconceived in a more empirical form to designate the medium of commonality in which historical beings are immersed. Any universal claims about history need to be framed within the specific productive systems analyzed by the various human sciences. Dilthey's drafts for the Continuation of the Formation contain extensive discussions of the categories most important for our knowledge of historical life: meaning, value, purpose, time, and development. He also examines the contributions of autobiography to historical understanding and of biography to scientific history. The finest summary of Dilthey's views on hermeneutics can be found in ""The Understanding of Other Persons and Their Manifestations of Life."" Here, Dilthey differentiates understanding relative to three kinds of manifestations of life. After giving his analysis of elementary understanding, he examines the role of induction in higher understanding and interpretation, and the relevance of transposition and re-experiencing for grasping individuality.",424.0,History,Literature
