Title,Authors,Published Date,Description,Page Count,Categories,Category
Handbook of Divorce and Relationship Dissolution,"Mark A. Fine, John H. Harvey",2013-12-19,"This Handbook presents up-to-date scholarship on the causes and predictors, processes, and consequences of divorce and relationship dissolution. Featuring contributions from multiple disciplines, this Handbook reviews relationship termination, including variations depending on legal status, race/ethnicity, and sexual orientation. The Handbook focuses on the often-neglected processes involved as the relationship unfolds, such as infidelity, hurt, and remarriage. It also covers the legal and policy aspects, the demographics, and the historical aspects of divorce. Intended for researchers, practitioners, counselors, clinicians, and advanced students in psychology, sociology, family studies, communication, and nursing, the book serves as a text in courses on divorce, marriage and the family, and close relationships.",696.0,Education,Education
Mentoring Beginning Teachers,Jean Boreen,2000,"Presents guidance for mentors of new teachers, explaining why mentors are needed and how to think like a coach, allow freedom to experiment, help with classroom management challenges, foster reflection, and encourage professional development.",152.0,Education,Education
Quality Assurance in Higher Education,"Don F. Westerheijden, Bjorn Stensaker, Maria Joao Rosa",2007-09-04,"By bringing together leading experts on quality assurance in higher education from seven countries (from Europe, the USA and South Africa), this volume intends to go several steps further than most publications on the same subject. Containing comprehensive discussion of the most relevant trends in quality assurance regulation, translation and transformation, researchers and policy makers will find an engaged, academic reflection on how quality assurance is embedded in higher education and in a dynamic way to assess its impacts and potential improvements.",267.0,Education,Education
Essentials of International Health,"Manoj Sharma, Ashutosh Atri",2010,"Essentials of International Health provides an introduction to international health with a focus on epidemiological, political, behavioral, sociological, cultural, and medical dimensions in the field. The text covers problems concerning both developed and developing countries (with an emphasis on developing countries) and introduces population-based public health approaches to solving international health problems. Topics include historical perspectives, health indicators, role of culture and behavior, communicable diseases, non communicable diseases, malnutrition, nutritional deficiencies and obesity, environmental health and population issues, health of women, health of children, mental health, world health systems, and future issues in international health. This text is ideal for undergraduate students, introductory graduate classes, and practitioners interested in working in developing countries.",523.0,Business & Economics,Education
The Grammar of Fantasy,Gianni Rodari,2024-05-16,"A collection of essays from the visionary storyteller Gianni Rodari about fairy tales and folk tales and their great advantages in teaching creative storytelling. ""Rodari grasped children's need to play with life's rules by using the grammar of their own imaginations. They must be encouraged to question, challenge, destroy, mock, eliminate, generate, and reproduce their own language and meanings through stories that will enable them to narrate their own lives."" --Jack Zipes ""I hope this small book,"" writes renowned children's author Gianni Rodari, ""can be useful for all those people who believe it is necessary for the imagination to have a place in education; for all those who trust in the creativity of children; and for all those who know the liberating value of the word."" Full of ideas, glosses on fairytales, stories, and wide-ranging activities, including the fantastic binomial, this book changed how creative arts were taught in Italian schools. Translated into English by acclaimed children's historian Jack Zipes and illustrated for the first time ever by Matthew Forsythe, this edition of The Grammar of Fantasy is one to live with and return to for its humor, intelligence, and truly deep understanding of children. A groundbreaking pedagogical work that is also a handbook for writers of all ages and kinds, The Grammar of Fantasy gives each of us a playful, practical path to finding our own voice through the power of storytelling. Gianni Rodari (1920-1980) grew up in Northern Italy and wrote hundreds of stories, poems, and songs for children. In 1960, he collaborated with the Education Cooperation Movement to develop exercises to encourage children's creative and critical thinking abilities. Jack Zipes is a renowned children's historian and folklorist who has written, translated, and edited dozens of books on fairytales. He is a professor at the University of Minnesota. Matthew Forsythe lives in Montreal where he draws and paints for picture books, comics, and animations.",0.0,Education,Education
Visible Learning: Feedback,"John Hattie, Shirley Clarke",2018-08-15,"Feedback is arguably the most critical and powerful aspect of teaching and learning. Yet, there remains a paradox: why is feedback so powerful and why is it so variable? It is this paradox which Visible Learning: Feedback aims to unravel and resolve. Combining research excellence, theory and vast teaching expertise, this book covers the principles and practicalities of feedback, including: the variability of feedback, the importance of surface, deep and transfer contexts, student to teacher feedback, peer to peer feedback, the power of within lesson feedback and manageable post-lesson feedback. With numerous case-studies, examples and engaging anecdotes woven throughout, the authors also shed light on what creates an effective feedback culture and provide the teaching and learning structures which give the best possible framework for feedback. Visible Learning: Feedback brings together two internationally known educators and merges Hattie’s world-famous research expertise with Clarke’s vast experience of classroom practice and application, making this book an essential resource for teachers in any setting, phase or country.",229.0,Education,Education
Distributed Leadership,James P. Spillane,2012-06-29,"James Spillane, the leading expert in Distributed Leadership, shows how leadership happens in everyday practices in schools, through formal routines and informal interactions. He examines the distribution of leadership among administrators, specialists, and teachers in the school, and explains the ways in which leadership practice is stretched over leaders, followers, and aspects of the situation, including routines and tools of various sorts in the organization such as memos, scheduling procedures, and evaluation protocols. This book is a volume in the Jossey-Bass Leadership Library in Education—a series designed to meet the demand for new ideas and insights about leadership in schools.",150.0,Education,Education
Chemistry of Fragrances,"David H Pybus, Charles S Sell",2007-10-31,"Modern perfumery is a blend of art, science and technology, with chemistry being the central science involved. The Chemistry of Fragrances aims to educate and entertain, and inform the audience of the very latest chemistry, techniques and tools applied to fragrance creativity. Beginning with the history of perfumes, which goes back over fifty thousand years, the book goes on to discuss the structure of the Perfume Industry today. The focus then turns to an imaginary brief to create a perfume, and the response to it, including that of the chemist and the creative perfumer. Consumer research, toxicological concerns, and the use of the electronic nose are some of the topics discussed on this journey of discovery. Written by respected experts in their fields, this unique book gives an insider view of """"mixing molecules"""" from behind the portals of modern-day alchemy. It will be enjoyed by chemists and marketeers at all levels.",349.0,Science,Education
Republic (Collins Classics),Plato,2021-09-16,"HarperCollins is proud to present its incredible range of best-loved, essential classics.",432.0,Philosophy,Education
Teacher King’s English Speaking Course Book 1 - Lithuanian Edition,Kevin L. King,2021-01-31,"Learn to speak English correctly! This is Book 1 of Teacher King’s English Speaking Course It contains 30 important lessons to help a student learn to speak English the right way! Level: Beginner to Intermediate - Students should have a basic knowledge of Speaking, Reading & Writing. Application: Self-learning & Classroom This workbook has been written for all ages, children and adults alike. This workbook features: - 30 excellent lessons with everyday topics - 300 important words used in daily life - 60 fun and everyday conversations and talks - Q&A section for each talk - 30 phrasal verbs for everyday topics - 30 verbs and different tenses - Easy interactive worksheets to learn speaking sentences correctly - Tests to reinforce knowledge of the lessons - Commonly used grammar tenses - Step-by-step grammar development - Vocabulary words include Lithuanian translations Teacher King’s English Speaking Course is the easiest way to learn English. Written by ESL specialist, Kevin L. King, who has taught English as a Second Language for over 30 years around the world.",127.0,Foreign Language Study,Education
Spring Awakening,Frank Wedekind,1980,"A tragi-comedy of teenage sex. Its fourteen-year-old heroine Wendla is killed by abortion pills. The young Moritz, terrorized by the world around him and especially by his teachers, shoots himself. The ending seems likely to be the suicide of Moritz's friend Melchior but in a confrontation with a mysterious stranger (the famous Masked Man) he finally manages to shed his illusions and face the consequences.",120.0,Drama,Education
Nobody Left to Hate,Elliot Aronson,2001-07,"Aronson, a social psychologist, offers concise, practical, and easy-to-apply strategies for creating a more supportive, stimulating, and compassionate environment in our schools.",210.0,Education,Education
Reading Contemporary Picturebooks,David Lewis,2001,"This work analyzes how picture books work, the role of picture books in learning to read, how children make meaning from pictures and how teachers can make best use of picture books in the classroom.",206.0,Education,Education
The Taming of the Shrew,William Shakespeare,2002,Table of contents,300.0,Drama,Drama
Faust,Johann Wolfgang von Goethe,1998,"The legend of Faust grew up in the sixteenth century, a time of transition between medieval and modern culture in Germany. Johann Wolfgang von Goethe (1749-1832) adopted the story of the wandering conjuror who accepts Mephistopheles's offer of a pact, selling his soul for the devil's greaterknowledge; over a period of 60 years he produced one of the greatest dramatic and poetic masterpieces of European literature.David Luke's recent translation, specially commissioned for The World's Classics series, has all the virtues of previous classic translations of Faust, and none of their shortcomings. Cast in rhymed verse, following the original, it preserves the essence of Goethe's meaning without sacrifice toarchaism or over-modern idiom. It is as near an `equivalent' rendering of the German as has been achieved.",244.0,German literature,Drama
Reading Greek Tragedy,Simon Goldhill,1986-05-08,An advanced critical introduction to Greek tragedy for those who do not read Greek. Combines the best contemporary scholarly analysis of the classics with a wide knowledge of contemporary literary studies in discussing the masterpieces of Athenian drama.,322.0,Drama,Drama
Ajax,Sophocles,1979,"Athena 'twas I Restrained Him, Casting On His Eyes O'ermastering Notions Of That Baneful Ecstasy, That Turned His Rage On Flocks And Mingled Droves Of Booty Yet Unshared, Guarded By Herdsmen. Then Plunging Amid The Thronging Horns He Slew.",396.0,Drama,Drama
Othello,William Shakespeare,2024-01-09,"A TALE OF RACISM, REVENGE, BETRAYAL AND JEALOUSY One of Shakespeare’s most performed tragedies written in approximately 1603, Othello still resonates today with its themes of racism, revenge, betrayal and jealousy. Shakespeare creates a powerful drama with the story of a marriage between the exotic Moor, Othello and the Venetian lady Desdemona. Despite building many differences into his hero and heroine, including race, age, and cultural background, most audiences believe the couple’s strong love could overcome these differences were it not for a once trusted cohort, lago, who sets out to destroy Othello. The play begins in the powerful city state of Venice, a center of trade and banking, known for its military might. War is raging between Venice and Turkey. Two men — Roderigo, a young gentleman and former suitor of Senator Brabantio's daughter Desdemona, and Iago, an ensign who claims to have been passed over for promotion by Othello, are outside Senator Brabantio's house to tell him the news of his daughter's elopement with Othello. Othello is a Moorish general in the Venetian army who is determined to lead his men to victory with his “trusted” ensign lago. But after being passed up for a promotion, Iago has plans of his own. Using Othello’s wife, Desdemona, as a pawn, Iago spins an elaborate web of deception leading Othello to believe that his wife is unfaithful and once lago has Othello where he wants him, revenge will be his. In the final dramatic scene of the play Othello strangles his wife, struggling with his love for her to the end.",189.0,Fiction,Drama
The Taming of the Shrew,William Shakespeare,2008-07-30,"Can a man tame an ill-tempered woman? Petruchio thinks he is up to the task in The Taming of the Shrew. William Shakespeare (1564 ż 1616) is the most influential writer in English history. Shakespeare has been called The Barb of Avon and Englandżs national poet. There are 2 narrative poems, 154 sonnets and 38 plays in his collected works. He began work as an actor and writer in London first writing comedies and historic plays. He later wrote tragedies. Romeo and Juliet, MacBeth and Othello are some of his more famous plays. The Taming of the Shrew was an early comedy. The play begins with a drunken man who is deceived into thinking he is a nobleman. He then watches this play in which the noble Petruchio married an outspoken ill-tempered woman. Katherine is eventually tamed to the will be Petruchio. The play has been adapted into opera, stage plays and screen plays. Cole Porterżs play Kiss Me Kate is one instance",160.0,Drama,Drama
"Twelfth Night, Or, What You Will",William Shakespeare,1994,"Twelfth Night is one of the most popular of Shakespeare's plays in the modern theatre, and this edition places particular emphasis on its theatrical qualities throughout. The introduction analyses the many views of love in the play, and the juxtaposition of happiness and melancholy used todramatize them. The presentation of the text has been re-thought in theatrical terms, and the exceptionally full an detailed commentary pays close attention to the often difficult language. The play's contrastig moods are emphasized by the use of music, which plays an important role in TwelfthNight; James Walker has re-edited the existing music from the original sources, and where none exist has composed settings compatible in style with the surviving originals, so that this edition offers material for all the music required in a performance, the only modern edition to do so. Theedition will be invaluable to actors, directors, and students at all levels.",256.0,Drama,Drama
King Lear,William Shakespeare,1990,"Shakespeare Made Easy is ideal for an introduction to Shakespeare. In each volume the complete original text is laid out side-by-side with a full modern English translation. Shakespeare Made Easy is intended for readers approaching the plays for the first time who find the language of Elizabethan poetic drama an initial obstacle to understanding and enjoyment. This series concentrates on the dramatic aspect of Shakespearea s works, enabling novices to become familiar with the plot and characters. The Shakespeare Made Easy series contains practical exercises to help students easily grasp the language, characters and themes of the plays.",324.0,Drama,Drama
Ion,"Euripides,",2014-05-08,"A translation of one of Euripides' finest plays by one of Britain's most experienced translators Ion is the story of the abandoned child Ion, reunited with her mother Xouthos",104.0,Drama,Drama
The Cambridge Guide to Asian Theatre,"James R. Brandon, Martin Banham",1997-01-28,"A comprehensive and authoritative single-volume reference work on the theatre arts of Asia-Oceania. Nine expert scholars provide entries on performance in twenty countries from Pakistan in the west, through India and Southeast Asia to China, Japan and Korea in the east. An introductory pan-Asian essay explores basic themes - they include ritual, dance, puppetry, training, performance and masks. The national entries concentrate on the historical development of theatre in each country, followed by entries on the major theatre forms, and articles on playwrights, actors and directors. The entries are accompanied by rare photographs and helpful reading lists.",266.0,Drama,Drama
Macbeth,William Shakespeare,2023-04-14,"Macbeth est une tragédie de William Shakespeare. Elle prend place dans l'Écosse médiévale et retrace de manière très romancée le règne de Macbeth (1040-1057), en s'inspirant de près du récit qu'en fait Raphael Holinshed dans ses Chroniques, parues en 1587. Dévoré d'ambition, le général Macbeth commet le crime de régicide pour s'emparer du pouvoir, poussé par son épouse Lady Macbeth, mais la culpabilité et la paranoïa les font peu à peu sombrer dans la folie. La date de rédaction de Macbeth est inconnue, mais elle pourrait se situer entre 1599 et 1606 si l'on tente de la lire à la lumière des événements contemporains, en particulier l'avènement du roi écossais Jacques VI sur le trône d'Angleterre en 1603 et la Conspiration des Poudres en 1605. Elle est publiée pour la première fois dans le Premier Folio en 1623. Macbeth est la plus courte des tragédies de Shakespeare et l'une de ses plus populaires : de nombreux acteurs de renom ont interprété les rôles de Macbeth et Lady Macbeth, et ses adaptations dans d'autres médias sont nombreuses. Une superstition théâtrale veut qu'elle soit maudite et qu'il faille plutôt l'appeler « la pièce écossaise » que prononcer son nom sur scène.",168.0,Drama,Drama
Faust,Johann Wolfgang von Goethe,1985,"Goethe's classic, enlivened by Randall Jarrell's fine translation and Peter Sis's dark, dreamy illustrations Randall Jarrell's translation of ""Faust ""is one of his most important achievements. In 1957 he inscribed Goethe's motto on the first page of his notebook--""Ohne Hast aber ohne Rast"" (""Without haste but without rest"")--and from then until his death in 1965 he worked on the masterpiece of his ""own favorite daemon, dear good great Goethe."" His intent was to make the German poetry free, unrhymed poetry in English. He all but finished the job before he died, and the few lines that remained untouched--""Gretchen's Room""--were rendered into English by Robert Lowell. This elegant new edition features numerous beautiful line drawings and jacket lettering by the renowned Czech artist Peter Sis, author of the award-winning books ""Starry Messenger: Galileo Galilei"" and ""Tibet: Through the Red Box.""",364.0,Drama,Drama
Dr. Faustus,Christopher Marlowe,1994,"One of Western culture's most enduring myths recounts a learned German doctor's sale of his soul to the devil in exchange for knowledge and power. Elizabethan playwright Christopher Marlowe transformed the Faust legend into the English language's first epic tragedy, a vivid drama that abounds in psychological insights and poetic grandeur.",65.0,Drama,Drama
"The Iliad (World Classics, Unabridged)",Homer,2016-09-01,"The story of the Iliad centers on the critical events in the last year of the Trojan War, which lead to Achilles's killing of Hektor and determine the fate of Troy. But Homer's theme is not simply war or heroism. With compassion and humanity, he presents a universal and tragic view of the world, of human life lived under the shadow of suffering and death, set against a vast and largely unpitying divine background. The Iliad is the first of the great tragedies.",406.0,Drama,Drama
Much Ado about Nothing,William Shakespeare,1998,"Much Ado About Nothing has long been celebrated as one of Shakespeare's most popular comedies. The central relationship, between Benedick and Beatrice, is wittily combative until love prevails. Broader comedy is provided by Dogberry, Verges and the watchmen.",228.0,Drama,Drama
Julius Caesar,William Shakespeare,1984,"Contains a new, modern-spelling edition of the play, commentary and notes, and production photographs and related art.",272.0,Drama,Drama
The Tempest,William Shakespeare,1998,"Each edition includes: - Freshly edited text based on the best early printed version of the play - Full explanatory notes conveniently placed on pages facing the text of the play - Scene-by-scene plot summaries - A key to famous lines and phrases - An introduction to reading Shakespeare's language - An essay by an outstanding scholar providing a modern perspective on the play - Illustrations from the Folger Shakespeare Library's vast holdings of rare books Essay by Barbara A. Mowat The Folger Shakespeare Library in Washington, D.C., is home to the world's largest collection of Shakespeare's printed works, and a magnet for Shakespeare scholars from around the globe. In addition to exhibitions open to the public throughout the year, the Folger offers a full calendar of performances and programs. For more information, visit www.folger.edu.",260.0,Drama,Drama
The Usable Past,"Keith S. Brown, Yannis Hamilakis",2003,"In this volume, scholars of history, archaeology and anthropology explore the located and contextual nature of historical narratives, analysing contested historical rituals, building style, and traditions, .",260.0,Drama,Drama
Othello,William Shakespeare,2012-02-29,"Mit dem Werkbeitrag aus Kindlers Literatur Lexikon. Mit dem Autorenporträt aus dem Metzler Lexikon Weltliteratur. Mit Daten zu Leben und Werk, exklusiv verfasst von der Redaktion der Zeitschrift für Literatur TEXT + KRITIK. Das Venedig der Renaissance ist ein Schmelztiegel der Kulturen, eine reiche Handelstadt, die Begehrlichkeiten weckt. Othello ist damit beauftragt, die Flotte der kleinen Republik in den Krieg zu führen. Die Venezianer vertrauen dem »Mohr« zwar die Sicherheit ihrer Stadt, nicht jedoch ihre Töchter an. Die Liebe Othellos zu der schönen Desdemona steuert, durch eine Intrige vergiftet, auf eine Tragödie zu.",247.0,Drama,Drama
A Doll's House,Henrik Ibsen,2018-01-09,"The classic play about a woman’s fight for independence and her desire to break free of her role as housewife. One of the best-known, most frequently performed modern plays, A Doll’s House richly displays the genius with which Henrik Ibsen pioneered realistic prose drama. The central character, Nora, epitomizes the human struggle against the humiliating constraints of social conformity. Her ultimate rejection of a smothering marriage and life in a “doll’s house” shocked theatergoers of the late nineteenth century and opened new horizons for playwrights and their audiences. However, daring social themes are only one aspect of Ibsen’s power as a dramatist. A Doll’s House demonstrates his ability to create realistic dialogue and a suspenseful flow of events, and bring to life the psychologically penetrating characterizations that make the struggles of his dramatic personages utterly convincing. Here is a deeply absorbing dramatic work as readable as it is eminently playable. This ebook has been professionally proofread to ensure accuracy and readability on all devices.",117.0,Drama,Drama
Romeo and Juliet,William Shakespeare,2001,The classic tragedy about the doomed young lovers is accompanied by historical and critical notes.,180.0,Drama,Drama
The Mystery of the Yellow Room,Gaston LeRoux,2021-01-01,"It all began one Sunday afternoon around three years ago. At home by myself, I was lounging on the couch and zapping idly across TV, young and carefree and looking for my kicks. Suddenly, I fell onto the start of an episode of Columbo. It drew me in and I watched it to the end, and after that I'd try and catch another episode whenever I could. Hi-tech procedural cop shows like CSI Wherever never appealed to me, but Columbo's top-drawer plots, writing and characters, plus a dazzling first episode directed by a certain young S. Spielberg, got me hooked. Betweentimes, lesser but no less entertaining detective shows like The Mentalist and Castle scratched the itch.",250.0,Drama,Drama
