Title,Authors,Published Date,Description,Page Count,Categories,Category
Agamemnon's Daughter,Ismail Kadare,2006,"In the title novella, a young man working for the state-controlled media agency experiences a vision of the ancient general Agamemnon, who warns him of the repercussions of his love affair with a high-ranking official's daughter, in a collection that also includes the short stories ""The Blinding Order"" and ""The Great Wall.""",252.0,Fiction,Fiction
Journey to the Center of the Earth,Jules Verne,2006-04-25,"The intrepid Professor Lindenbrock embarks upon the strangest expedition of the nineteenth century: a journey down an extinct Icelandic volcano to the Earth’s very core. In his quest to penetrate the planet’s primordial secrets, the geologist—together with his quaking nephew Axel and their devoted guide, Hans—discovers an astonishing subterranean menagerie of prehistoric proportions. Verne’s imaginative tale is at once the ultimate science fiction adventure and a reflection on the perfectibility of human understanding and the psychology of the questor. As David Brin notes in his Introduction, though Verne never knew the term “science fiction,” Journey to the Centre of the Earth is “inarguably one of the wellsprings from which it all began.”",242.0,Fiction,Fiction
Future Shock,Alvin Toffler,1981,"Explores the nature and implications of a third wave of change that is now creating a new civilization with its own life-styles, jobs, sexual attitudes, concepts of family and love, economic structures, and political philosophies",537.0,Fiction,Fiction
Ready Player Two,Ernest Cline,2020-11-24,"#1 NEW YORK TIMES BESTSELLER • The thrilling sequel to the beloved worldwide bestseller Ready Player One, the near-future adventure that inspired the blockbuster Steven Spielberg film. NAMED ONE OF THE BEST BOOKS OF THE YEAR BY THE WASHINGTON POST • “The game is on again. . . . A great mix of exciting fantasy and threatening fact.”—The Wall Street Journal AN UNEXPECTED QUEST. TWO WORLDS AT STAKE. ARE YOU READY? Days after winning OASIS founder James Halliday’s contest, Wade Watts makes a discovery that changes everything. Hidden within Halliday’s vaults, waiting for his heir to find, lies a technological advancement that will once again change the world and make the OASIS a thousand times more wondrous—and addictive—than even Wade dreamed possible. With it comes a new riddle, and a new quest—a last Easter egg from Halliday, hinting at a mysterious prize. And an unexpected, impossibly powerful, and dangerous new rival awaits, one who’ll kill millions to get what he wants. Wade’s life and the future of the OASIS are again at stake, but this time the fate of humanity also hangs in the balance. Lovingly nostalgic and wildly original as only Ernest Cline could conceive it, Ready Player Two takes us on another imaginative, fun, action-packed adventure through his beloved virtual universe, and jolts us thrillingly into the future once again.",385.0,Fiction,Fiction
Taras Bulba,Nikolái V. Gogol,2006-12-19,"Feroces, crueles, valientes y apasionados, los cosacos hacen temblar la estepa bajo los cascos de sus caballos. Y entre ellos se encuentra Taras Bulba, un anciano lleno aún de fuerza e inteligencia que junto a sus hijos, Ostap y Andrí, avanzará por tierras polacas con intención de vengar su fe ortodoxa burlada por los católicos. Ninguna guarnición, ciudad amurallada o iglesia podrán detenerlos, hasta que la desgracia se cierna sobre ellos y el apuesto y enamoradizo Andrí haga que su padre maldiga el día en que lo engendró. Taras Bulba, una anomalía entre la obra más conocida de Gogol, es una aventura trepidante, una sinfonía en perpetuo crescendo, en la que cada capítulo es más intenso y sorprendente que el anterior. un fresco tan afinadamente dibujado y tan vívido que resulta absolutamente intemporal.",154.0,Literary Criticism,Fiction
The Plague,Albert Camus,1991-05-07,"“Its relevance lashes you across the face.” —Stephen Metcalf, The Los Angeles Times • “A redemptive book, one that wills the reader to believe, even in a time of despair.” —Roger Lowenstein, The Washington Post A haunting tale of human resilience and hope in the face of unrelieved horror, Albert Camus' iconic novel about an epidemic ravaging the people of a North African coastal town is a classic of twentieth-century literature. The townspeople of Oran are in the grip of a deadly plague, which condemns its victims to a swift and horrifying death. Fear, isolation and claustrophobia follow as they are forced into quarantine. Each person responds in their own way to the lethal disease: some resign themselves to fate, some seek blame, and a few, like Dr. Rieux, resist the terror. An immediate triumph when it was published in 1947, The Plague is in part an allegory of France's suffering under the Nazi occupation, and a timeless story of bravery and determination against the precariousness of human existence.",312.0,Fiction,Fiction
The Boleyn Inheritance,Philippa Gregory,2008-12-30,"THREE WOMEN WHO SHARE ONE FATE: THE BOLEYN INHERITANCE ANNE OF CLEVES She runs from her tiny country, her hateful mother, and her abusive brother to a throne whose last three occupants are dead. King Henry VIII, her new husband, instantly dislikes her. Without friends, family, or even an understanding of the language being spoken around her, she must literally save her neck in a court ruled by a deadly game of politics and the terror of an unpredictable and vengeful king. Her Boleyn Inheritance: accusations and false witnesses. KATHERINE HOWARD She catches the king's eye within moments of arriving at court, setting in motion the dreadful machine of politics, intrigue, and treason that she does not understand. She only knows that she is beautiful, that men desire her, that she is young and in love -- but not with the diseased old man who made her queen, beds her night after night, and killed her cousin Anne. Her Boleyn Inheritance: the threat of the axe. JANE ROCHFORD She is the Boleyn girl whose testimony sent her husband and sister-in-law to their deaths. She is the trusted friend of two threatened queens, the perfectly loyal spy for her uncle, the Duke of Norfolk, and a canny survivor in the murderous court of a most dangerous king. Throughout Europe, her name is a byword for malice, jealousy, and twisted lust. Her Boleyn Inheritance: a fortune and a title, in exchange for her soul. The Boleyn Inheritance is a novel drawn tight as a lute string about a court ruled by the gallows and three women whose positions brought them wealth, admiration, and power as well as deceit, betrayal, and terror. Once again, Philippa Gregory has brought a vanished world to life -- the whisper of a silk skirt on a stone stair, the yellow glow of candlelight illuminating a hastily written note, the murmurs of the crowd gathering on Tower Green below the newly built scaffold. In The Boleyn Inheritance Gregory is at her intelligent and page-turning best.",596.0,Fiction,Fiction
For Whom the Bell Tolls,Ernest Hemingway,2019-07-16,"Introduced by Hemingway’s grandson Seán Hemingway, this newly annotated edition and literary masterpiece about an American in the Spanish Civil War features early drafts and supplementary material—including three previously uncollected short stories on war by one the greatest writers on the subject in history. In 1937 Ernest Hemingway traveled to Spain to cover the civil war for the North American Newspaper Alliance. Three years later he completed the greatest novel to emerge from “the good fight,” and one of the foremost classics of war literature in history. Published in 1940, For Whom the Bell Tolls tells of loyalty and courage, love and defeat, and the tragic death of an ideal. Robert Jordan is a young American in the International Brigades attached to an antifascist guerilla unit in the mountains of Spain. In his portrayal of Jordan’s love for the beautiful Maria and his superb account of El Sordo’s last stand, Hemingway creates a work at once rare and beautiful, strong and brutal, compassionate, moving, and wise. “If the function of a writer is to reveal reality,” Maxwell Perkins wrote Hemingway after reading the manuscript, “no one ever so completely performed it.” Greater in power, broader in scope, and more intensely emotional than any of the author’s previous works, it stands as one of the best war novels of all time. Featuring early drafts and manuscript notes, some of Hemingway’s writings during the Spanish Civil War, and three previously collected stories of his on the subject of war, as well as a personal foreword by the author’s son Patrick Hemingway, and a new introduction by the author’s grandson Seán Hemingway, this edition of For Whom the Bell Tolls brings new life to a literary master’s epic like never before.",576.0,Fiction,Fiction
Night Flight,Antoine de Saint-Exupery,2018-01-01,"Under the pressure of his boss, the intransigent Riviere, the airmail pilot Fabien attempts a perilous flight during a heavy night-time thunderstorm in Argentina. As conditions get worse and the radio communication with Fabien becomes increasingly difficult, Riviere begins to question his uncompromising methods, and his distress turns to guilt when the pilot's wife comes to find him in search of answers.Based on Saint-Exupery's own experiences as a commercial pilot, Night Flight is a haunting and lyrical examination of duty, destiny and the individual, as well as an authentic and tragic portrayal of the intrepid early days of human air travel.",129.0,Fiction,Fiction
The Darkest Night,Gena Showalter,2012-06-15,"All her life, Ashlyn Darrow has been tormented by voices from the past. To end the nightmare, she has come to Budapest seeking help from men rumored to have supernatural abilities, not knowing she'll be swept into the arms of Maddox, their most dangerous member—a man trapped in a hell of his own. Neither can resist the instant hunger that calms their torments…and ignites an irresistible passion. But every heated touch and burning kiss will edge them closer to destruction—and a soul-shattering test of love….",383.0,Fiction,Fiction
The Complete Stories,Franz Kafka,2012-10-24,"The complete stories of one of the greatest writers of the twentieth century, the author of The Metamorphosis and The Trial. “An important book, valuable in itself and absolutely fascinating. The stories are dreamlike, allegorical, symbolic, parabolic, grotesque, ritualistic, nasty, lucent, extremely personal, ghoulishly detached, exquisitely comic, numinous, and prophetic.” —The New York Times The Complete Stories brings together all of Kafka’s stories, from the classic tales such as “The Metamorphosis,” “In the Penal Colony,” and “A Hunger Artist” to shorter pieces and fragments that Max Brod, Kafka’s literary executor, released after Kafka’s death. With the exception of his three novels, the whole of Kafka’s narrative work is included in this volume. “[Kafka] spoke for millions in their new unease; a century after his birth, he seems the last holy writer, and the supreme fabulist of modern man’s cosmic predicament.” —from the Foreword by John Updike",612.0,Fiction,Fiction
Solaris,Stanisław Lem,1971,"A science fiction novel about a sentient ocean that was the ruling intelligence of Solaris. Its vast mindand enigmatic personality exerted a powerful force on those humans who contacted it. And to Kris Kelvin, a galactic researcher from Earth, it had presented a strange and awesome gift ...",230.0,Fiction,Fiction
How to Stop Time,Matt Haig,2018-02-06,"From the New York Times bestselling author of The Midnight Library. “A quirky romcom dusted with philosophical observations….A delightfully witty…poignant novel.” —The Washington Post “She smiled a soft, troubled smile and I felt the whole world slipping away, and I wanted to slip with it, to go wherever she was going… I had existed whole years without her, but that was all it had been. An existence. A book with no words.” Tom Hazard has just moved back to London, his old home, to settle down and become a high school history teacher. And on his first day at school, he meets a captivating French teacher at his school who seems fascinated by him. But Tom has a dangerous secret. He may look like an ordinary 41-year-old, but owing to a rare condition, he's been alive for centuries. Tom has lived history--performing with Shakespeare, exploring the high seas with Captain Cook, and sharing cocktails with Fitzgerald. Now, he just wants an ordinary life. Unfortunately for Tom, the Albatross Society, the secretive group which protects people like Tom, has one rule: Never fall in love. As painful memories of his past and the erratic behavior of the Society's watchful leader threaten to derail his new life and romance, the one thing he can't have just happens to be the one thing that might save him. Tom will have to decide once and for all whether to remain stuck in the past, or finally begin living in the present. How to Stop Time tells a love story across the ages—and for the ages—about a man lost in time, the woman who could save him, and the lifetimes it can take to learn how to live. It is a bighearted, wildly original novel about losing and finding yourself, the inevitability of change, and how with enough time to learn, we just might find happiness. Soon to be a major motion picture starring Benedict Cumberbatch.",352.0,Fiction,Fiction
A Study in Scarlet,Arthur Conan Doyle,2016-10-25,"A Study in Scarlet, detective novel by Conan Doyle, written in 1886, the story marks the first appearance of Sherlock Holmes and Dr. Watson, who would become two of the most famous characters in popular fiction. The book's title derives from a speech given by Holmes, an amateur detective, to his friend and chronicler Watson on the nature of his work, in which he describes the story's murder investigation as his ""study in scarlet"": ""There's the scarlet thread of murder running through the colourless skein of life, and our duty is to unravel it, and isolate it, and expose every inch of it."" The story, and its main characters, attracted little public interest when it first appeared. Only 11 complete copies of the magazine in which the story first appeared, Beeton's Christmas Annual for 1887, are known to exist now and they have considerable value. Although Conan Doyle wrote 56 short stories featuring Holmes, A Study in Scarlet is one of only four full-length novels in the original canon. The novel was followed by The Sign of the Four, published in 1890. A Study in Scarlet was the first work of detective fiction to incorporate the magnifying glass as an investigative tool.",167.0,Fiction,Fiction
The Picture of Dorian Gray,Oscar Wilde,2019-07-12,"The Picture of Dorian Gray is the only published novel by Oscar Wilde, appearing as the lead story in Lippincott's Monthly Magazine on 20 June 1890, printed as the July 1890 issue. The magazine's editors feared the story was indecent as submitted, so they censored roughly 500 words, without Wilde's knowledge, before publication. But even with that, the story was still greeted with outrage by British reviewers, some of whom suggested that Wilde should be prosecuted on moral grounds, leading Wilde to defend the novel aggressively in letters to the British press. Today, Wilde's fin de siècle novella is considered a classic. This new edition from Immortal Books includes footnotes and images.",188.0,Fiction,Fiction
The Hunchback of Notre-Dame,Victor Hugo,2022-05-10,"Reprint of the original, first published in 1869.",473.0,Fiction,Fiction
Alpine Ballad,Vasil Bykau,2018-01-01,"A handful of families, several generations, more than a few wars. MoscTowards the end of World War II, a Belarusian soldier and an Italian girl escape from a Nazi concentration camp. The soldier wonders if he should get rid of the girl; she is a burden and is slowing him down. However, he cannot bring himself to abandon her in the snowy wilderness. Somewhere along the way, the two develop feelings for each other, but their love is not destined to grow beyond the edge of the mountains. Yet their bond cannot be denied, and in the end it proves stronger than death itself. From the master of psychological narrative whose firsthand experience with World War II enabled him to re-create the ordeal on pages of his books, Alpine Ballad is Vasil Bykau’s most heartfelt story. Bykau sends a powerful message to his readers: human values can be extrapolated and in the context of war people can still uphold their humanity. An altruistic, philanthropic project of Glagoslav Publications, Alpine Ballad is coming out as a gesture of peace and a reminder to all of the human cost of wars that ransack our planet to this day. Translated from Belarusian by Mikalai Khilo. The previous translations of Alpine Ballad were based on the Soviet-censored Russian version of the original manuscript. ow, Kabul, Barcelona. Anna Nemzer announces herself on the literary scene boldly and loudly with this debut novel about the insane, unspeakable nature of war, about human fears, treachery, lies, fateful coincidences and destinies during warfare, when there is no room left for love. The protagonists survived the war and are rescued from captivity. They are not able, however, to leave the experiences of the war behind them and move on with their lives. The novel explores what happens once the conflict is over, as they learn to live without the war, with all their loves, passions and weaknesses.",172.0,Fiction,Fiction
The Odyssey of Homer,Homer,2005-12-06,"Homer's epic chronicle of the Greek hero Odysseus' journey home from the Trojan War has inspired writers from Virgil to James Joyce. Odysseus survives storm and shipwreck, the cave of the Cyclops and the isle of Circe, the lure of the Sirens' song and a trip to the Underworld, only to find his most difficult challenge at home, where treacherous suitors seek to steal his kingdom and his loyal wife, Penelope. Favorite of the gods, Odysseus embodies the energy, intellect, and resourcefulness that were of highest value to the ancients and that remain ideals in out time. In this new verse translation, Allen Mandelbaum--celebrated poet and translator of Virgil's Aeneid and Dante's Divine Comedy --realizes the power and beauty of the original Greek verse and demonstrates why the epic tale of The Odyssey has captured the human imagination for nearly three thousand years.",559.0,Fiction,Fiction
There There,Tommy Orange,2018-06-05,"PULITZER PRIZE FINALIST • NATIONAL BESTSELLER • A wondrous and shattering award-winning novel that follows twelve characters from Native communities: all traveling to the Big Oakland Powwow, all connected to one another in ways they may not yet realize. A contemporary classic, this “astonishing literary debut” (Margaret Atwood, bestselling author of The Handmaid’s Tale) “places Native American voices front and center” (NPR/Fresh Air). One of The Atlantic’s Great American Novels of the Past 100 Years Among them is Jacquie Red Feather, newly sober and trying to make it back to the family she left behind. Dene Oxendene, pulling his life together after his uncle’s death and working at the powwow to honor his memory. Fourteen-year-old Orvil, coming to perform traditional dance for the very first time. They converge and collide on one fateful day at the Big Oakland Powwow and together this chorus of voices tells of the plight of the urban Native American—grappling with a complex and painful history, with an inheritance of beauty and spirituality, with communion and sacrifice and heroism A book with “so much jangling energy and brings so much news from a distinct corner of American life that it’s a revelation” (The New York Times). It is fierce, funny, suspenseful, and impossible to put down--full of poetry and rage, exploding onto the page with urgency and force. There There is at once poignant and unflinching, utterly contemporary and truly unforgettable. Don't miss Tommy Orange's new book, Wandering Stars!",256.0,Fiction,Fiction
Sunset Park,Paul Auster,2010-11-04,"Paul Auster's Sunset Park is set in the sprawling flatlands of Florida, where twenty-eight-year-old Miles is photographing the last lingering traces of families who have abandoned their houses due to debt or foreclosure. Miles is haunted by guilt for having inadvertently caused the death of his step-brother, a situation that caused him to flee his father and step-mother in New York seven years ago. What keeps him in Florida is his relationship with a teenage high-school girl, Pilar, but when her family threatens to expose their relationship, Miles decides to protect Pilar by going back to Brooklyn, where he settles in a squat to prepare himself to face the inevitable confrontation with his father - a confrontation he has been avoiding for years. Set against the backdrop of the devastating global recession, and pulsing with the energy of Auster's previous novel Invisible, Sunset Park is as mythic as it is contemporary, as in love with baseball as it is with literature. It is above all, a story about love and forgiveness - not only among men and women, but also between fathers and sons.",318.0,Fiction,Fiction
The Uncensored Picture of Dorian Gray,"Oscar Wilde, Nicholas Frankel",2012-08-13,"Over 120 years after Oscar Wilde submitted The Picture of Dorian Gray for publication, the uncensored version of his novel appears here for the first time in a paperback edition. This volume restores material, including instances of graphic homosexual content, removed by the novel’s first editor, who feared it would be “offensive” to Victorians.",273.0,Fiction,Fiction
Growth of the Soil,Knut Hamsun,1972-05-12,The story of an elemental existence in rural Norway.,449.0,Fiction,Fiction
The Complete Grimm's Fairy Tales,Brothers Grimm,1972,"The stories of magic and myth gathered by the Brothers Grimm have become part of the way children—and adults—learn about the vagaries of the real world. Cinderella, Rapunzel, Snow-White, Hänsel and Gretel, Little Red-Cap (Little Red Riding Hood), and Briar-Rose (Sleeping Beauty) are only a few of the more than two hundred enchanting characters included in this volume. The tales are presented just as Jacob and Wilhelm Grimm originally set them down: bold, primal, just frightening enough, and endlessly engaging. With black-and-white illustrations throughout Illustrated by Josef Schari / Commentary by Joseph Campbell Part of the Pantheon Fairy Tale and Folklore Library",878.0,Fiction,Fiction
The Prince and the Pauper,Mark Twain,2015-04-28,"A Classic Story of Switched Identity “When I am king they shall not have bread and shelter only, but also teachings out of books, for a full belly is little worth where the mind is starved.” ― Mark Twain, The Prince and the Pauper The Prince and the Pauper by Mark Twain is an 1881 novel that has been adapted many times. When a young poor boy wanders near the palace gates, he meets the Prince of Wales (Edward VI) who bears an uncanny resemblance. They decide to switch clothes and end up switching roles. Edward discovers the stark class inequality in England and Tom struggles to survive as the prince. When the king dies, Edward must race against the clock and the bounds of society to regain his rightful throne. This Xist Classics edition has been professionally formatted for e-readers with a linked table of contents. This eBook also contains a bonus book club leadership guide and discussion questions. We hope you’ll share this book with your friends, neighbors and colleagues and can’t wait to hear what you have to say about it. Xist Publishing is a digital-first publisher. Xist Publishing creates books for the touchscreen generation and is dedicated to helping everyone develop a lifetime love of reading, no matter what form it takes",218.0,Juvenile Fiction,Fiction
My Struggle: Book 1,Karl Ove Knausgaard,2013-05-02,"A New York Times bestseller, My Struggle: Book 1 introduces American readers to the audacious, addictive, and profoundly surprising international literary sensation that is the provocative and brilliant six-volume autobiographical novel by Karl Ove Knausgaard. It has already been anointed a Proustian masterpiece and is the rare work of dazzling literary originality that is intensely, irresistibly readable. Unafraid of the big issues—death, love, art, fear—and yet committed to the intimate details of life as it is lived, My Struggle is an essential work of contemporary literature.",382.0,Fiction,Fiction
